Rating,Review,Name,Location,Date
5,I had a lovely experience with Stephanie who helped explain the different options i had and which phone and plan would suit me best and she helped me choose a new phone that will last me. Overall a lovely experience and amazing help was provided,Mackenzie,GB,2025-05-19T16:18:22.000Z
5,Very well done to alejandro and his amazing customer service. He helped me with my new sim contract as I used to be with 3 and done me a better deal,Maria Vitorino,GB,2025-05-19T16:11:49.000Z
5,Helpful knowledgeable staff who are so willing to help.,William,GB,2025-05-19T16:05:23.000Z
5,"Emma has been fantastic, new broadband much cheaper, new phone upgrade and new  iPad also, saved us some money and lots of new products we are very happy",Michael Owen,GB,2025-05-19T15:58:45.000Z
5,"Tarang was very helpful and kind, he helped setting up my phone and I’m very happy with the service.",Shilan Kader,GB,2025-05-19T15:53:32.000Z
5,"Jordan was great help, cant recommend this shop enough!!",John Levings,GB,2025-05-19T15:52:21.000Z
5,"Excellent, professional and prompt customer service.Patient and courteous throughout.Would definitely recommend seeing Fank at the Gosport branch.",Zoe Harmsworth,GB,2025-05-19T15:52:07.000Z
5,"Glory is  very Friendly and works fast, will be suimt nėr again next time.",Martin Sipavicius,GB,2025-05-19T15:49:02.000Z
5,Come into the Vodafone store with a problem on my device musa an advisor I spoke to was extremely helpful and helped me fix my problem,John Ball,GB,2025-05-19T15:48:27.000Z
5,Emma was fantastic and read all paper work to detail was brilliant service,Gibs,GB,2025-05-19T15:38:42.000Z
5,Mark was fabulous. Great help. Explained everything clearly.,Consumer,GB,2025-05-19T15:36:37.000Z
4,Visited the Reading store and was served by Talha who got me a great deal on a new Sim-Only contract. Very helpful chap.,Alex,GB,2025-05-19T15:30:07.000Z
5,Came in to see Hayley today and she was very patient with me and took me through my upgrade options,Mark Hague,GB,2025-05-19T15:24:34.000Z
5,Very helpful and informative experience from Sam. Thank you,Jim Bennett,GB,2025-05-19T15:23:46.000Z
5,Hayley was amazing today and took us through really good sim only deals and broadband as well,Sharon Hague,GB,2025-05-19T15:22:31.000Z
5,Been really helpful,mark michael cahill,GB,2025-05-19T15:19:11.000Z
5,,Usama Khan,GB,2025-05-19T15:11:50.000Z
5,Come in today to assist a client with changing over his phone contact. We were assisted by a lovely lady called eve who was absolutely fantastic. She was very thorough and explained how everything will work over the next few weeks. We appreciate all the help we received !,Shannon Alexander,GB,2025-05-19T15:10:38.000Z
5,"First class service from Beatrice, absolutely brilliant!",Tarnia  Talbot,GB,2025-05-19T15:08:11.000Z
5,"Really helpful, good service and sorted out a good deal",Tracy Budd,GB,2025-05-19T14:58:26.000Z
5,"sensational service, polite and very attentive",Wanderson Souza,GB,2025-05-19T14:58:03.000Z
5,Very good experience with lots of very great advice  as how to proceed with the phone I got Excellent person who help me with things I need to knowMade it easy to go ahead with the purchase of my new phone,MS SUSAN CONNETT,GB,2025-05-19T14:38:45.000Z
5,Very helpful assistant nazia,Consumer,GB,2025-05-19T14:35:47.000Z
5,Jack was very helpful and knowledgeable,Morag Collyer,GB,2025-05-19T14:34:51.000Z
5,Ali was very helpful with helping me to keep by old number.he was very helpful,Bernie Hillsdon,GB,2025-05-19T14:34:06.000Z
5,Beckie was excellent: helpful in both advice and explanation and personable throughout quite a long process. Greatly appreciated.,Nick Jones,GB,2025-05-19T14:30:22.000Z
5,Gemma was great,Glyn Pritchard,GB,2025-05-19T14:28:59.000Z
5,I signed a new contract today and the shop assistant Declan was very helpful and transferred my data to a new phone easily.,Alan Donaldson,GB,2025-05-19T14:27:08.000Z
5,"Excellent service, great deal and Jack was super quick and helpful.",Matt,GB,2025-05-19T14:22:15.000Z
5,"Went into Vodafone at the potteries to discuss my airtime plan, I got paired up with Ryan and I’m so glad I did! He did an amazing job at discussing the plans in very clear detail and helped me with sorting out my new airtime plan! Very easy will 100% be returning again and is a great advocate for Vodafone! Thank you very much Ryan for your support Jordan",Jordan Lowe,GB,2025-05-19T14:22:00.000Z
5,Pleasant friendly and knowledgeable staff quick and painless and saved money in the process,Sean,GB,2025-05-19T14:03:27.000Z
5,"Good customer service, very informative.",Abdul Azad,GB,2025-05-19T14:02:41.000Z
5,Good Service Nd Friendly Staff They Have So Much Patience One Of The Staff Name Ravi He's A Good Person I'm So Happy,Dhinnu Manchala,GB,2025-05-19T13:59:48.000Z
5,George lead me through the process of changing multiple phones and plans to help me get the best offers. Very pleased with the final result.,Mr Golledge,GB,2025-05-19T13:55:04.000Z
5,Really good service from your colleague Stephen.  Very knowledgeable,Mark Sharpe,GB,2025-05-19T13:49:22.000Z
5,I come into Walsall store and sat with an advisor Musa and he helped with the network issues on my phone and was really polite and kind as I did not understand how to use my phone properly I am really happy with the service provided by this advisor,Rosa Clifford,GB,2025-05-19T13:45:45.000Z
5,"Had a lovely experience in the shop with Manisha and Harika, they were so helpful and friendly. Great customer service!!",Joy,GB,2025-05-19T13:44:28.000Z
5,"Kaz was brilliant, sorted my home broadband deal out and was very clear and patient with me",June Westwood,GB,2025-05-19T13:44:09.000Z
5,Rahan made us welcome into the store and qe were really seen quickly. Explained the situation and went for an trade in and upgrade instead of having phone repaired.  Have got one phone to take away and another being delivered to store.  Explained trade in rules and how to set up the phone. Thank you for your time,Ann Barnes,GB,2025-05-19T13:43:13.000Z
5,Come into the Walsall store spoke to an advisor musa and he was great really helped me with my phone and also sorted us out a great deal really please with the customer service of this store will definitely be returning later in the year for an upgrade on my wife's phone,Tony Clifford,GB,2025-05-19T13:40:51.000Z
5,Jordan explained everything simply. He identified a good deal uo suit my use.,David,GB,2025-05-19T13:35:32.000Z
5,,jean marr,GB,2025-05-19T13:33:52.000Z
5,"We went to Vodafone which is in Swindon town ,Mac was very helpful and gave us a great deal of, really happy with it . Thank you Mac",Cyprien Braganza,IN,2025-05-19T13:32:02.000Z
5,Jasleen is a very respectful and humble customer service personnel She attended to me in a very polite manner,PINOK GROUP,GB,2025-05-19T13:28:57.000Z
4,"Mario was polite, professional and made the transaction smooth and easy",Asher Simms,GB,2025-05-19T13:26:43.000Z
5,Upgraded my phone in Glos with viki - great service and very helpful,Keith Garbett,GB,2025-05-19T13:23:34.000Z
5,Great advice and choice for phones and plans walking away with a better phone then I was wanting great customer service,Jamie Byers,GB,2025-05-19T13:16:51.000Z
5,amazing service from vodafone southend store. Jakub was very knowledgeable and very helpful,Rinymol Peter,GB,2025-05-19T13:13:07.000Z
5,Did upgrade with Joel and the service was excellent,Roy Philip,GB,2025-05-19T13:08:45.000Z
1,"19/05 - Dear Vodafone Customer Service,I hope this email finds you well. I am writing to express my dissatisfaction with the service I have been receiving since switching to Vodafone.Ten days ago, I transferred from Virgin to Vodafone due to Virgin’s inability to provide internet services for 17 days. Unfortunately, my experience with Vodafone has not been any better, as I have already encountered four outages in the past ten days.I have contacted your customer service five times, and the resolution offered has been inadequate, with the issue being attributed to CityFibre. While I understand that Vodafone uses CityFibre's network, my contract is with Vodafone, and I expect Vodafone to address and resolve these service disruptions promptly.The frequent outages have significantly impacted my daily activities and work, and I am seeking immediate action to rectify this situation. I would appreciate it if you could:Provide a clear explanation of the cause of these repeated outages.Offer a timeline for resolution.Compensate for the inconvenience suffered due to lack of consistent services.I have been paying Vodafone for reliable internet service, and I expect Vodafone to take responsibility for ensuring its provision, regardless of the third-party networks involved.Please treat this matter with urgency and let me know how you intend to resolve these issues.Thank you for your attention to this matter. I look forward to your prompt response.Sincerely,19/05 7 hours latter Update: contacted the team as requested not only they gave the same responses as I had before but I wasted another 3 hours explaining everything over again! So it’s even worse than before20/05 NEW UPDATE - 30 hours and couting with no resolution and no internet. Vodafone are not willing to let me out of the contract withou paying Early Exit Fee but also is not giving me a sulution to my problem.",Danilo Busseni,GB,2025-05-20T11:19:12.000Z
5,Beckie has been brilliant - two of us both wanting new phones and plans and iPads - she was endlessly patient and super helpful. Thanks so much Beckie!,Chrissie,GB,2025-05-19T13:06:33.000Z
5,Adam was very helpful and patient. Worked hard to get me the best deal and served my needs well.,Delfina Angiolini,GB,2025-05-19T12:53:29.000Z
1,"I received an email nearly a week ago out of the blue telling me that I owed Vodafone money for equipment. I.e. an iPhone I purchased when I was a Vodafone broadband/mobile customer which I had been paying for and it turned out that I had accidentally cancelled the DD so I immediately tried to contact Vodafone by email asking them for details so I could either pay off any remaining balance in full or reset the DD. I since emailed them twice but absolutely no response! In the meantime I have received two threatening emails that unless I contacted they would pass it to a collection company. With that comes the problem with my credit reference file but clearly Vodafone don’t care! So Vodafone why the threatening emails? This could all have been resolved within minutes and the DD reset or the balance paid off but clearly you would rather make my life more difficult instead. Do your homework first about this company before using them as a supplier. 1600. 19.05,2025.  So Vodafone you are sorry for the experiences I have had from your company. So why are you not able to “reach out” to me as you say I can? You have my number , you have my email address and you want to apologise so call me or email me and offer me some of that Customer Service you say was lacking and I am sure we can resolve this issue very quickly,",Barry Allan,GB,2025-05-19T15:02:27.000Z
5,"Rayyan was a pleasure to do business with,  helpful , kind and full of knowledge of the product , top bloke",Lee Pepper,GB,2025-05-19T12:49:28.000Z
5,Aysha Very friendly and very helpful,diablo .king,GB,2025-05-19T12:44:37.000Z
5,Billy was great in Cannock and was very pleasant and assisted me with my needs,Mick Poole,GB,2025-05-19T12:43:46.000Z
1,"Ordered broadband.  Couldn't fit due to rat chewing the fibre in a post. Fair enough so waited for it to be fixed got told 31st, then 3rd then 7th then 13th then 28th of May. Fair enough open reach could just do the work but reality is vodaphone just kept telling me the wrong dates for it to be fixed. I'm an ex telecoms engineer so I know the pole just needed capping at the top and a splice in the post... Hour work easy. Instead they are trying to request permission to change the whole post which means planning permission which takes months. I thought well give it time I get the £6 compo / day. It'll be practically be free when doneHowever, then some smarty pants from vodaphone starts calling in the day, kindly told them I'm working nights, need to sleep call me back later I need sleep. Guy ignores this keeps yapping. I hung up then decided I'll just keep ringing even when I've picked the phone up I'm getting more calls from vodaphone.Now I've cancelled my broadband order and I'm going to cancel both mobile contracts next.Congrats. Maybe next time you'll let a man sleep. Not too sure why it asks for a location for Vodafone in York or Aberdeen when filling this in cause the issue was clearly in India.",Tommy Lea,GB,2025-05-19T12:34:22.000Z
1,"I genuinely regret choosing Vodafone for both my broadband and mobile phone contract. I was sold their premium ""Pro II Broadband"" package on the promise of easy setup and expert support. None of it was delivered.The broadband never linked to my account, despite following every instruction. I tried to call for help — only to discover that it’s not even possible to speak to a human being. I was forced to use a chatbot, which got me nowhere. Repeated requests for a callback were refused or ignored. Eventually, I was promised a call within the hour, and then a manager would follow up within 7 days. It’s now well past that, no one has ever called back.On top of that, I took out the mobile plan as part of a bundle which included a trade-in discount. I honestly described the phone, sent it in, and later received a vague text saying it was ""not as described"" — with no explanation and the discount seemingly withdrawn.Most upsetting of all, I told Vodafone at the point of purchase that I had recently undergone brain surgery, and asked that communication be made slowly, verbally, and followed up in writing. I was assured this would be no problem. Instead, I have been fobbed off by automated systems, and nobody at Vodafone has made the slightest effort to respect the reasonable adjustments I requested, which they are legally required to make under the Equality Act.I’ve sent multiple formal complaints, all ignored. No resolution. No apology. No service.This has been exhausting and completely unacceptable. I’m now escalating to CISAS (Vodafone’s dispute resolution scheme), but the time and energy this has cost me is not something I will soon forget.Avoid Vodafone at all costs, and if you do choose them, pray you never need support.PS Don't believe me, go look at any Facebook post and you will see a list of very unhappy customers trying to seek a resolution through other means, because they don't care about service!",Matthew MacDonald,GB,2025-05-19T12:33:41.000Z
5,Well the advisor on duty knows his job and I find it quite easy and straightforward anytime he attends to me,okonkwo oc,GB,2025-05-19T12:33:36.000Z
5,"Jamie was brilliant, he transferred all my data and gave me a great deal on my phone plan",Consumer,GB,2025-05-19T12:31:37.000Z
5,,Mr phillip pugh,GB,2025-05-19T12:28:02.000Z
5,Shannon helped me set up my new phone. 10/10 recommend,Lynda Pugh,GB,2025-05-19T12:27:56.000Z
5,"Arranged to upgrade. Tried to use App. Extreme difficulty. AI gone mad? Persevered, without App. Success. Fantastic speed 511Mbps, best ever👍😀👍",David,GB,2025-05-20T12:56:48.000Z
1,"Edit*** after spending 4 hours trying to contact Vodafone on both the number provided and the social media chat- as said in Vodafones response to this review. Nothing has been resolved and they just keep advising us to call the same number while still holding the phone. Once again, poor customer service from Zidane and Khushboo who said they didnt know how to help, other than for me to pay £750. STAY AWAY from this company. I have been a loyal vodafone customer for over 20 years. I bought a phone with vodafone that is still in warranty. The sim card reader stopped working. They tried to give me a virtual sim, which didnt work. Then when sending it to them they quoted me £750 to repair for a phone i can buy brand new for £300. I then questioned the person on the phone and he laughed and ended the phone on me. I pay for 4 phones and will never pay a penny to vodafone again. Stay far away from this company, no loyalty to customers whatsoever. Its clear why they have a 1 star review, go to EE or O2 and stay away from this backstabbing company. I am taking business far away from them.",Tamzin,GB,2025-05-19T20:22:10.000Z
5,Holly knew exactly how to resolve my problem listening intently explaining to me in non tech terms and got it resolved very quickly,Tom Plumb,GB,2025-05-19T11:54:14.000Z
1,Money taken out today more than contractual agreement as well as wrong payment date. I phoned to resolve due to taken out of my sons birthday money after it should of been taken out week previously and for less. Phoned to resolve to which spoke to a RELATIONS MANAGER who then confirmed wrong dates to me after being told by other employees dates and confirmed by myself.He then continued to state wrong amounts not in my contract as well as wrong dates for billing and payment. Ive now been left not able to get my sons birthday present today .its hard enough being a wheelchair user dealing with health but today not being able to get my son his little tikes car im distraught.Call reference included in review for any vodafone employees.,Robin,GB,2025-05-19T11:49:10.000Z
5,Maha and Huda helped me out so much. My eSIM card couldn’t work and I was very confused and stressed. They listened to me and calmly help me to get new sim with internet. I am staying in London for 5 days so now I wont have to worry about internet,Martyna Biegaj,PL,2025-05-19T11:22:50.000Z
5,The person I dealt with was lesle in the pontefract store she was excellent,Paul Horsfall,GB,2025-05-19T11:16:38.000Z
5,Needed upgrade and visited store who helped me with a great deal and got me setup. Very pleased,Lorraine,GB,2025-05-19T11:05:46.000Z
5,The team was really nice and helped me find the best plan,Barbara Hartland,GB,2025-05-19T11:00:09.000Z
5,"Jamie was extremely helpful and friendly, gave me a great deal on my new phone and even transferred all the data for me",LdsS,GB,2025-05-19T10:56:55.000Z
5,Demi helped me and my wife get a contract and we are happy with how well her service was,Afrim Sadiku,GB,2025-05-19T10:31:24.000Z
5,"Demi service has been great, help us get a good deal on the sim card",Afrim Sadiku,GB,2025-05-19T10:29:38.000Z
1,"Ordered Vodafone home broadband on 9th April, install date 12th May. CityFibre team installed ONT box on 12th May as planned but no internet connection via Vodafone 24hr later. I contacted Vodafone who advised the sale/connection was not completed their end and would take a further 3-5 business days to complete - after a whole month since the order date! Spoke with Vodafone (via the tortuous TOBI chat) today,19th May, to ask for activation status after their initial reply below and they advised me to wait until 27th May before checking for progress!? Vodafone account cancelled!Vodafone still haunts me! Cancellation glitch prevented cancellation with fibre provider CityFibre which prevents my new ISP from activating me until 4th June! Ofcom are you listening, wheres that number...?  28th May: Received email from VF advising my account is fixed and billing will be automatically generated!?",Ian Morgan,GB,2025-05-28T12:28:47.000Z
5,"Thanks to Catalin for the excellent help and support in putting together a phone and plan upgrade that gave me good benefits. Clear explanations of all the changes, much appreciated.",Andy Bartram,GB,2025-05-19T09:02:49.000Z
1,"Once I arrived in the UK for the first time, they convinced me to sign a 2-year contract with a monthly fee of 12.5 £ for the first 6 months. However, I was naive and didn't notice that it was a marketing trap. Now, my wife and I are paying 63 £ monthly for just 2 lines, and they are not accepting any cancellations or even changing plans with fewer data. My wife contacted them multiple times and explained to them she couldn't find a job and couldn't afford the bill, but they threatened her that if you don't pay the bill, it would be bad for your credit. They are not showing any flexibility. Be careful, don't trust any long-term contract with operators, especially Vodafone.",arash mortezapour,GB,2025-05-18T23:56:27.000Z
5,I was having trouble with coverage on my previous network so I called into the Vodafone shop in Ards shopping centre. I had a chat with the manager and he recommended their Voxi Sim as I am only a Pay as you go customer. He helped me obtain my PAC code so that I could keep my old number and set the whole thing up for me. I am amazed by the improvement in coverage compared to previous provider. I run a small business and attend events where I accept card payments but this only works when I have good mobile data coverage - I was losing sales before I switched to Vodafone. Would highly recommend and can only describe my experience in Vodafone Ards as a Sterling service. Thank you Vodafone 😊,Justin BERRY,GB,2025-05-18T21:45:40.000Z
5,"Sam helped me a lot throughout our talk. He explained to me all the offers and packages, and guided me on the best one.",Panajot Kukli,GB,2025-05-18T20:42:38.000Z
5,The salesperson was so friendly and positive about everything his attitude and energy even lifted my own mood.,Martins Cvetkovs,GB,2025-05-18T20:01:24.000Z
5,Jamie was great . came in the other day to set up new broadband and he talked me through everything and reassured me . great price and great customer service. would recommend,mollie,GB,2025-05-18T18:50:22.000Z
1,"Hell on earth dealing with Vodafone, much better company’s to get a phone off be careful, abusive to the customers , no duty of care or respect",CBD DOCK,GB,2025-05-18T18:35:01.000Z
5,,Bogdan Silaghe,GB,2025-05-18T18:33:21.000Z
5,Adam is the best advisor,rd rony,GB,2025-05-18T18:30:21.000Z
5,Great service today from Rohan who chatted through my options today and  recommended a phone and plan that were perfect for me.,N/A,GB,2025-05-18T18:20:14.000Z
5,Fantastic service and Becky was very knowledgeable and informed throughout my upgrade 10/10,Alun Sturley,GB,2025-05-18T18:08:00.000Z
5,It was a very good experience provided by Manoj in the Coventry city centre branch.He explained all the different plans and what would suit me and my husband.We were here to convert to Vodafone and he helped us a lot.,Priyanka Dutta,GB,2025-05-18T17:57:39.000Z
4,Came in with exactly what I wanted and got what I wanted apart from no Apple Watches in store and having to order myself wasn’t the best. But apart from that it was good.,Iain McFarlane,GB,2025-05-18T17:49:36.000Z
5,So helpful would have been lost without Ryan so knowledgeable Thank you so much 11out of 10,Diane,GB,2025-05-18T17:48:53.000Z
5,"Eleanor was super helpful, explained everything. Answered any questions we had ✨✨✨✨✨",Customer,GB,2025-05-18T17:31:24.000Z
5,Vodafone in Chatham has exceptional customer service a young girl and a young man I believe there names were mollie and Jamie were brilliant they were so helpful and managed to successfully help me with what I needed I couldn’t praise them enough I highly recommend if you have any difficulties with your mobile device etc then definitely give them a visit,Robbie,GB,2025-05-18T17:27:01.000Z
5,"Ben was so helpful, brought our bills down and gave us great advice.Brilliant customer service .",Wendy,GB,2025-05-18T17:19:05.000Z
5,Amazing service and very helpful,strangeFNBR,GB,2025-05-18T17:18:09.000Z
5,Thank you so much  for helping me today I'm so very grateful for the help from Charlotte,Lesley,GB,2025-05-18T16:57:41.000Z
5,SHAKUNT was very helpful in finding us a good Sim only deal. We upgraded our 3 contracts same time.  Thanks again,Sweet Funny,GB,2025-05-18T16:55:18.000Z
5,Wanted to upgrade my plan at the store. The person who helped me was very knowledgeable and found the best plan for me. Very patient and helpful.P.S. The store manager wasn’t very helpful. Was very standoffish with my husband when he asked him a question - apparently he was busy checking something online.,Mrs. Wilson,GB,2025-05-18T16:39:08.000Z
1,"Phoned up for information before renewing my contract which I have had with Vodafone for 26 years. I was exposed to hard sell and dubious information and a vindictive action of cutting off one of my mobile phones when I asked for a PAC number (which I was not sent). I complained, was offered £40 Morrison’s voucher and had to wait 24 hours before the phone was reconnected. 5 days later, no Morrison’s voucher and I have spent 134 minutes over 5 call trying to resolve this. Twice my call was terminated by Vodafone.",Ann Jones,GB,2025-05-18T16:23:27.000Z
5,Had a great experience with Vodafone Westfield. Arif is very helfpful! Keep it up.,Kristoffer Batayon,GB,2025-05-18T16:20:15.000Z
5,Cassie was extremely helpful and knowledgeable.,Tracey Johnson,GB,2025-05-18T16:19:12.000Z
5,"Sina was very helpful, got me the sort of deal I was looking for in next to no time at all. Top class customer service.",Consumer,GB,2025-05-18T15:43:39.000Z
5,jonathon was amazing in helping me pick my new phone . Infact he helped me 3 years ago pick my last phone . He also realised i was entitled to free earphoneswhich was a massive bonus . Delighted with my new phone at a great price thanks jonathon,Justine higfins,GB,2025-05-18T15:43:02.000Z
5,Excellent service,Matthew McCafferty,GB,2025-05-18T15:42:24.000Z
5,,Michelle Ellis,GB,2025-05-18T15:41:11.000Z
5,,Wade Guest,GB,2025-05-18T15:30:52.000Z
5,Georgia was AMAZINGGG!!,Esther Gurung,GB,2025-05-18T15:28:03.000Z
5,Excellent customer service by Vasco! Made it super easy to start a new contract.,Kristin Anderson,GB,2025-05-18T15:13:14.000Z
