Rating,Review,Name,Location,Date
5,"Andreea was amazing at helping me , she explained everything really well and gave amazing customer service that was very honest and transparent which is rare these days. She made a what would usually be a stressful time really nice :)Her other work college Archie was also brilliant !",Charlotte Brown,GB,2025-05-11T15:43:50.000Z
5,"I have a grate experience with halimah, she help me a lot, my phone and also my sim. Explain me everything in details and help me my my sim as it was not working at all. I’m not from Birmingham I just came for a shopping and this happed so she help throughout everything until everything was perfectly fine. Unfortunately I don’t remember my order number. (My name is Hassan)",Sayeeda Ramzan,GB,2025-05-11T15:20:42.000Z
5,We bought google pixel from the westbrom new square store the staff was really good . Denisa helped us alot and she was really nice .,Rajveer singh Hundal,GB,2025-05-11T15:20:11.000Z
5,Superb customer service as always.Most employees have been there a while and know their customers- Richard went through all my options and gave some really good advice-Always have a positive experience in the Bury St Edmunds Vodaphone Brach.Thank you again,Rachel Wood,GB,2025-05-11T15:10:18.000Z
5,"We had a lot of trouble with our phone upgrade in the Scottish stores, no one was able to help us until we arrived in Manchester and went to a store there. We dealt with badara and we could not have been happier. He helped us through every single step of the way, he is making us consider always driving down to Manchester to deal with phone upgrades with how helpful he was. Best employee I’ve ever dealt with in my 10 years of being with Vodafone.",Summer Robertson,GB,2025-05-11T15:00:43.000Z
5,Badara was great help after having a lot of issues regarding setting up my partners phone.  Managed to resolve issues and kept us posted throughout the week we were on holiday. If anyone is in the Manchester make sure to ask for him.,Matthew Payne,GB,2025-05-11T14:57:47.000Z
5,"amazing customer service, friendly polite and super helpful, Scott explained all the current deals and the best prices available, really positive visit at the worthing branch.",sarah robinson,GB,2025-05-11T14:51:15.000Z
5,"I met Khurram today, I came because my mobile was stolen last night on the way back home. I came to asked for a new SIM card. He was polite and friendly, helping me with kindness.",Arattha Udomsathapol,GB,2025-05-11T14:46:21.000Z
5,"John was brilliant today , I had to sort out my device plan and air time all done today Gave me lots of options and discussed with spending over 30 min looking ay better option & deals Than you",Pasindu J Liyanage,GB,2025-05-11T14:38:40.000Z
5,Excellent customer service from a brilliant advisor called Femi. Highly recommended.,Ian Hastings,SA,2025-05-11T14:31:24.000Z
5,Syeda was very helpful and polite and offered good advice to get to what we wanted.,Julie Kerslake,GB,2025-05-11T14:27:39.000Z
5,We had Sabi help us today at Vodafone Brent Cross and he went out of his way to help me. My phone wa stolen and he helped me with eSIM and also ended us cleaning my phone too! Thank you for helping me when I was feeling quite upset about the stolen phone.,Jajini Varghese,GB,2025-05-11T14:08:50.000Z
5,Becky was the staff member who helped me today..She was confident well spoken and gave me all the information I needed without using complicated methods.Handled everything well and set me up with a offer and contract that I am more than happy with.Will definitely recommend her to others looking to upgrade etc.,Nessim Aroussi,GB,2025-05-11T14:04:34.000Z
5,Dhruvesh was very helpful. Top customer service.,Aeran Johnson,GB,2025-05-11T14:01:37.000Z
5,Haider was really helpful answered all my questions straight away no hassle.,Doru Mancescu,GB,2025-05-11T13:55:45.000Z
5,Very knowledgeable on products available. Great solutions provided.,Dimitri Tsangalis,GB,2025-05-11T13:54:23.000Z
5,,Alex,GB,2025-05-11T13:52:40.000Z
5,"Ryan was very informative and helpful throughout, quick and effective",Jasmine Coley,GB,2025-05-11T13:51:41.000Z
5,Ayub was very helpful as always and I'm happy to visit my local Vodafone store,Mohammad Ajmal Toor,GB,2025-05-11T13:39:29.000Z
5,Brilliant and very helpful service from Marley,Caroline Boak,GB,2025-05-11T13:24:31.000Z
5,Today I was accompanied by Dina in store she was very helpful explained everything so clearly and I was very happy with the service I got today,Antonis,GB,2025-05-11T13:19:33.000Z
5,Went into stotd kyle did a trade-in for me. Was super quick and helpful.10\10,Sally Buffery,GB,2025-05-11T13:13:09.000Z
5,"Brilliant service from Lachlan today, knowledgeable, interested, helpful, quick to explain and reassuring. Pleasure to have his support. You should be very happy Vodafone.",John Hanson,GB,2025-05-11T13:11:36.000Z
5,Ed was very helpful and knowledgeable. He fixed my issue brilliantly. Thanks,James Davies,GB,2025-05-11T13:11:31.000Z
5,"Very nice people in there , very helpful, I’m very happy 😃",customer,GB,2025-05-11T13:02:37.000Z
5,Aysha has helped me go from apple back to Google after trying for months to get along with a new device she help me trade in my old iPhone and got me a new Google pixel set up I would come back in the future,John,GB,2025-05-11T12:54:55.000Z
5,Wonderful experience with Viktoria - sorted out my phone for me Thank youuuu,christine,GB,2025-05-11T12:49:11.000Z
5,Absolute first class service by Philtricia in the touchwood branch.  So helpful.,Consumer,GB,2025-05-11T12:41:40.000Z
2,"Guaranteed a same day refund for a faulty doggle.32 days later, refund hasn't been recieved. And I've been charge an extra £44 for a non existing simcard.When asked after 20 days why the funds haven't been sent I was told, that the refund team hasn't even been notified or initiated my return. ""spoke to returns who have confirmed its been returned but the refunds team have not been notified so we have sent a request of and it should accept it in the next 24/48 hours after that you should get your £50 refund in the next 14 working days"".No refund recieved. Wouldn't reccomend. £100 loss so far.",JB,GB,2025-05-11T12:38:17.000Z
5,"Lewis was extremely helpful, did exactly what I needed in an emergency, even helped me set up my new phone.  Extremely pleased with the service I received today.",customer,GB,2025-05-11T12:32:07.000Z
5,"Ellis, was brilliant, excellent service",Vanessa Southgate,GB,2025-05-11T12:27:48.000Z
5,Very straight forward and helpfull,Shannon nugent,GB,2025-05-11T12:27:37.000Z
5,"Ana Verry helpful and professional im verry apriciate for all helps ive got,and all explain what i get",Tomasz Wyczk,GB,2025-05-11T12:18:06.000Z
5,Very Freidly adviser Bradley. Extremely helpful and has guided us the best way to go for our upcoming phone upgrades,vicky,GB,2025-05-11T12:17:06.000Z
5,,Leigh Thomas,GB,2025-05-11T12:04:05.000Z
5,"Dhruvesh was very attentive, nothing was too much trouble and he explained everything in full detail. Brilliant, definitely will recommend him to my friends 👍.",John Jones,GB,2025-05-11T11:44:29.000Z
5,"Ibby was brilliant in helping me source a new phone, I was having problems with the Vodafone to complete my trade in but the store was able to solve this and I could walk away with my new phone",Charotte Berryman,GB,2025-05-11T11:41:30.000Z
5,,Emma,GB,2025-05-11T11:37:15.000Z
1,"Stay well clear,  absolute joke of a company, waited a month and a half to be connected to broadband, endless cancelled appointments and then just cancelled, I can honestly say it's probably the worst company I've ever dealt with.",Craig Lauderdale,GB,2025-05-11T10:51:47.000Z
1,"Absolutely baffled by Vodafone's upgrade policy. I've been a paying customer, never missed a bill, and now that I’m eligible for an upgrade, they’ve declined it after a fresh credit check? Excuse me? What other network does that? I was previously with O2, and if you paid off your device, you could upgrade freely—no ridiculous hoops to jump through and certainly no invasive credit checks just to give them more money.Vodafone, you might want to rethink your priorities. Alienating loyal, creditworthy customers over something as petty and nonsensical as a credit check for an upgrade is how you lose people. It's not 2009 anymore—users have options, and I, for one, will be exploring every single one of them. You’ve officially made it to the list of “networks to avoid at all costs.”Unbelievable.",Yusuf Morris,GB,2025-05-11T10:40:04.000Z
5,,N R Wokingham,GB,2025-05-11T09:55:36.000Z
1,"To be honest, this is the worst network I have ever used in uk. I can't even watch a YouTube video without lagging also never get into their monthly contract subscription's, they won't even care or allow to cancel it if raise any concerns. Shame on you Vodafone!",Rahul C L,GB,2025-05-11T00:34:50.000Z
5,Joe was very knowledgable and was very helpful and explained it all very clearly,Mrs Denise Dyke,GB,2025-05-11T00:07:44.000Z
5,Extremely helpful and knowledgeable about products. Excellent service,Nicola,GB,2025-05-10T23:25:30.000Z
1,Avoid Avoid Avoid. Customer services had me on the phone for over half an hour. I was trying to make a payment for the remainder of my minimum term. They kept sending me a text to put in my card details I was on hold for ages and they kept saying payment had not gone through. They would not let me hang up and I was on hold for ages. Very arrogant customer adviser with a lack of empathy. I lost my temper and I had to hang up. Disgusting service. They made me very very angry over the phone.,claire proctor,GB,2025-05-10T21:19:17.000Z
5,Bought new phone and Luke was the guy to go too  He was amazing help me understand things with me phone and was very patient with me Thankyou Luke highly recommend Cribbs Causeways Vodafone been  with Vodafone for over 26 years,SB,GB,2025-05-10T20:37:02.000Z
5,Chris worked very hard to give us what we needed with our phone contracts! Nothing was too much trouble! Would highly recommend both him and Vodafone - we will be back!,Sarah Taylor,GB,2025-05-10T20:19:52.000Z
5,The staff were very helpful and helped me get what I needed,martin davies,GB,2025-05-10T20:01:06.000Z
5,"I have been putting off having a new phone for ages, but the lovely young lady, Samantha, in the Dover shop, made it sooooo easy for me. She was friendly, understanding and efficient, thank you, I am so grateful for all her help.",Lisa English,GB,2025-05-10T19:54:19.000Z
1,"I was supposed to be connected on 17 April. They told me a couple of days before the 17th that city fiber engineers faced a challenge. They call me and explain that they will get the next update around the 30th. I call them on the 30th and they have no update! They told me that I will be connected by 8 May. I wait again and call them a couple of days before the 8th. It turns out that city fiber wants me to get a consent from my neighbor to dig in their garden. I find this request ridiculous and also very unspecific (how much of their garden do they need to dig?). I ask specific questions and wait again for a couple of days. Then they now tell me that an engineer can attend and explain what needs to be done but the earliest they can do is the 29th of May.Before choosing Vodafone, one thing I should have realized is that they rely on City Fiber for connecting my home to the network. They may promise a date but that is if only everything goes well. This is different from a company that actually owns a fiber network.Even within the providers depending on City Fiber’s network, I think I would choose a different one because I get the sense that Vodafone does not take any proactive steps to connect me as soon as possible. They have not called me once since the challenge became obvious. If I hadn’t called them and asked what is going on, I wouldn’t have received any updates. They seem to have no way to prioritize me even though I am waiting to be connected for three weeks.EDIT: the copy and paste reply to this review accurately summarizes my experience. They are extremely friendly but do not listen to customers.",RT,GB,2025-05-10T21:52:00.000Z
5,Very kind and good service Siva and Hussni,Anne Dayyoub,GB,2025-05-10T19:37:24.000Z
5,The advisor put all his efforts into satisfying our requirements. We’ve found the best deals with him in this store. The service was perfect :),Sora Park,GB,2025-05-10T19:15:22.000Z
5,Junaid give me good contract deal very helpful,Mamidi Subhash,GB,2025-05-10T19:07:35.000Z
5,"We had a fantastic experience at Vodafone today, all thanks to Joe! He was incredibly helpful, knowledgeable, and patient. Joe got us an amazing deal on both Wi-Fi and mobile eSIM services, making the whole process smooth and stress-free. It's rare to find someone so genuinely committed to customer satisfaction. Highly recommend asking for Joe if you're visiting—he’s the best!",sharvari toke,GB,2025-05-10T18:32:24.000Z
5,"Ed was really great, friendly, helpful and made the purchase a pleasure.",Mr Hayden Kavanagh,GB,2025-05-10T18:08:49.000Z
1,"When I set up my broadband and phone, the site kept crashing on me. So I ended up joining over the phone.  I've never been able to login in. I can't reset the password either, as the reset code message never gets sent to my phone. I've never been sent a bill, I've been getting charged every month. But I don't actually know what for. Some months its a bit more or a bit less, but I have no idea why. As I've never been able to see a bill.I got an email this week saying my contract was up. But as I've never been able to log in, I couldn't see the offers. I got so fed up that I couldn't log in so I changed providers. But now they want to charge me a £80 early leaving fee. But I've never seen my contract, so I don't actually know what day it ends on. I think I'm just going to have to take the £80 hit for my sanity. We are just going around and around in circles with customers services. (They always try to be helpful, but we never get anywhere. The AI chatbot that they keep pushing you to on the website is useless though).It just really annoys me, why tell me the contract is ending and then charge me a early leaving fee. £80 is quite a lot money for me. I really feel like there has been an IT issue with my account since I joined that seems to be unfixable.  Edit - The reply below is exactly my point. I get the same script over and over again. Going around and around in circles until I feel like banging my head off a wall. That's why I'm cutting my losses and leaving. Even though I think its grossly unfair that I'm getting charged a leaving fee, when Vodafone told me my contract was finished. I'm losing money now because Vodafone can't seem to fix my account details on your own system. You don't seem to have someone who can actually fix the problem. I think the details were entered incorrectly when I joined, and I don't know what the operator has entered as my details. That's why I can't get anywhere. And why does it have to be done via Facebook or X. Why can't you give people an email address for example.",Daniel G,GB,2025-05-10T20:01:58.000Z
5,Very happy with my experience at Vodphone Widnes! Ash the senior advisor was very helpful!,Debbie Morris,GB,2025-05-10T18:01:05.000Z
5,Lukas was really nice!,Chloe Leigh,GB,2025-05-10T17:53:00.000Z
5,"Callam was very helpful putting my deal in place and happy with Dav with  his support after,  really helpful would recommend to visit bluewater and see the team. Thank you all.",Consumer,GB,2025-05-10T17:23:27.000Z
5,Found the staff to be exceedingly helpful. Kamil gave me the customer journey I thoroughly enjoyed. Thank you all for doing so.,Nick Cantrell,GB,2025-05-10T17:19:12.000Z
5,"Great service once again from the brilliant staff, always helping and willing to help. Thanks again",Dan Tillett,GB,2025-05-10T17:14:19.000Z
5,"The two gentlemen at the front desk were very helpful and very lovely in helping me. They were very understanding and accommodating thankyou very much! Helped my friend and while I was there got me a nice new one too, thank you Imran and Serj",Annabelle Dunne,GB,2025-05-10T17:11:57.000Z
5,I was dealt with very professionally by Emily in the Plymouth branch and left with a nice big grin on my face knowing I was in safe hands,Gary Wiles-Rourke,GB,2025-05-10T17:11:43.000Z
5,Wow I’m amazed by the service I received from Daniel G in vodafone exeter. I was expecting a complicated expensive process but he made it very simple to understand and I was sorted out in no time. Will 100% be coming back for future purchases.,Nick Penny,GB,2025-05-10T17:02:56.000Z
5,My experiance with max was great help me with technical issues well respected staff member 👍,Daz,GB,2025-05-10T16:54:55.000Z
5,,Craig Taylor,GB,2025-05-10T16:50:47.000Z
5,Cheuk the advice and the service was excellent and many thanks,David Alice,GB,2025-05-10T16:49:13.000Z
5,New S25+ in Yeovil today great service from Liam.,Lynda Dickason,GB,2025-05-10T16:49:09.000Z
5,Rachael was very polite and helpful she explained everything lovely young lady.,Amanda Lowe,GB,2025-05-10T16:38:32.000Z
5,Lovely store in the heart of Brixton. Gabriela was amazing. A very kind and sweet professional with a lovely attitude. She gave me a great experience and was extremely helpful. Highly recommending this store. Rest of the staff were also very friendly. Thank you team!,Merima Becevic,GB,2025-05-10T16:36:04.000Z
5,"great service,lovely staff helped in every way possible x",Bethany lane,GB,2025-05-10T16:35:54.000Z
5,"Faysal assisted me today with sim transfers and more info’s about my sim plan, he did a great job and been helpful!! Brilliant Assistance!",Razvan Victor,GB,2025-05-10T16:34:14.000Z
5,"Excellent service from vik, Ashton store has always been helpful.",Elvis Kusi,GB,2025-05-10T16:33:17.000Z
5,Great service,absolute unit,GB,2025-05-10T16:32:42.000Z
5,Ayub was extremely helpful. Great service. Friendly and helpful.,Ann Syddall,GB,2025-05-10T16:26:24.000Z
5,Saj Jay and Vabs were great. Excellent customer services and dealt with my enquiry.,Mohammed Younis,GB,2025-05-10T16:19:25.000Z
5,"A smooth click & collect transaction. The staff were polite, professional and more than happy to answer my queries. Would recommend!",Karen Shaw,GB,2025-05-10T16:17:05.000Z
5,Erald did a great job helping meThank you,Shanti,GB,2025-05-10T16:11:53.000Z
5,Mohammed was extremely helpful - went way and above and beyond to help - good man,customer,GB,2025-05-10T16:11:53.000Z
1,"Your staff was very busy on conversations with each others at store, dont looking on it that customer is waiting.",Jozef Belica,GB,2025-05-25T08:44:58.000Z
5,"CHEUK was very friendly, thorough and patient with my questions. He made the experience comfortable and straightforward.",customer,GB,2025-05-10T16:06:12.000Z
5,,Paul Banner,GB,2025-05-10T16:03:39.000Z
5,Macarena was very polite and helpful today in helping me get my new contract and new phone,EMMA BENTON,GB,2025-05-10T16:02:34.000Z
5,,Anon,GB,2025-05-10T16:00:05.000Z
5,Jacob was great and gave 💯 service,Mantoa Khesa,GB,2025-05-10T15:52:19.000Z
5,Me and my partner came to sort out end if contract phones. Zak was very helpful and made things very easy and straightforward.,Wendy McGready,GB,2025-05-10T15:37:56.000Z
5,Matt and Carly were very helpful with my purchase. They were happy to help and answer the questions. Carly offered me to come back if any problems in setting up.,Laura,GB,2025-05-10T15:37:19.000Z
5,Fantastic Service and quality from Samanth,Nick Thacker,GB,2025-05-10T15:35:34.000Z
5,Ali was extremely helpful in guiding us through our new broadband and phone contracts,Darren Elliott,GB,2025-05-10T15:29:10.000Z
5,Haider was fantastic in making sure my fiance and I got the best deal possible and the whole team was really welcoming and happy to assist with any issues we had! Highly recommend.,Matthew Linney,GB,2025-05-10T15:26:17.000Z
5,"Fantastic service from Ali, he sorted me out with a cracking deal",Beth Simons,GB,2025-05-10T15:24:11.000Z
5,Very helpful staff and very patient with  good selection of products,Peter Sutton,GB,2025-05-10T15:22:23.000Z
5,Has sorted my upgrade,Martine Ward,GB,2025-05-10T15:20:50.000Z
5,"Georgia was superbly professional and helpful, this was a really easy experience. Thank you.",Jon Edy-Berry,GB,2025-05-10T15:16:46.000Z
5,"It was a really good assistance and support, that Mr. Vetus given us when we went to cancel our broadband. Final, we ended up continuing with Vodafone.",ANU PAUL,GB,2025-05-10T15:01:34.000Z
5,Ali the magical genius helped me out alot definitely recommend,Robo,GB,2025-05-10T15:00:10.000Z
5,Samuel sorted me out with a new phone at a good price and even helped me set it up too.,Rolo,GB,2025-05-10T14:59:01.000Z
5,"Great experience, very nice",Lee,GB,2025-05-10T14:54:58.000Z
5,Very helpful from Sean an excellent service,Stacey jones,GB,2025-05-10T14:54:14.000Z
5,Service was quick and easy and sorted everything with no problems.,Leo,GB,2025-05-10T14:51:41.000Z
5,I have just visited Haverfordwest store. After  experiencing no help at all yesterday on my land because my phone had locked me out in the end they said there was nothing more  they could do. So I would definitely give the young gentleman  who looked after me 5stars his name was ALAN. Thankyou,Christine Budd,GB,2025-05-10T14:47:12.000Z
5,Super sales member. Really great experience and got more than I wanted for a great price,Heather Jones,GB,2025-05-10T14:43:35.000Z
5,"Monwar Has been very helpful, kind and he is very knowledge.",Jafor,GB,2025-05-10T14:42:57.000Z
5,Rachel was very helpful. Went through the different options & looked for the best discount available for me. Would recommend the service I received in store.,Larraine Tyler,GB,2025-05-10T14:38:32.000Z
5,"Thank you Junaid! I only popped in to enquire about a potential upgrade for my daughter’s smashed phone. Walked away with discount on my home broadband, a new phone and a very happy daughter! Thank you, thank you, thank you 😊",Tara Richardson,GB,2025-05-10T14:35:52.000Z
5,"Excellent service, explained everything very thoroughly.",jee Kalu,GB,2025-05-10T14:32:38.000Z
5,"Lewis was really helpful, gave us advice and present the best offer!",Justyna P,GB,2025-05-10T14:28:44.000Z
5,raihan helpful and friendly,Mrs Judy Homer,GB,2025-05-10T14:26:20.000Z
5,He is good really to the customers of vodafone.he is very approachable and accomodating,Mr ARIEL GREGG BALENA,GB,2025-05-10T14:22:41.000Z
5,Great service and very knowledgeable,Gemma,GB,2025-05-10T14:17:18.000Z
5,Saw Megan today to renew my SIM contracts I always make sure I see Megan when I go into Vodafone she is very go,George Walker,GB,2025-05-10T14:15:04.000Z
5,Coree was a friendly and helpful,Judith Brindley,GB,2025-05-10T14:12:10.000Z
5,He was very helpful and polite,Mrs Jones-Morgan,GB,2025-05-10T14:11:36.000Z
5,Haz was good would recommend,Carla Jane Martin-McVeigh,GB,2025-05-10T14:08:35.000Z
5,Good service by Aadil. Very knowledgeable and cheerful. Pleasure to visit.,Daphne Hender,GB,2025-05-10T14:07:12.000Z
5,Sam was very good. Sorted me out a new sim only,Isack Stanley Prathees,GB,2025-05-10T14:02:44.000Z
5,Great and polite service very helpful and informative from Evie thank you,cameron kerner,GB,2025-05-10T13:58:57.000Z
5,"Mark has served me twice now for two different contracts. Very informative, helpful and takes his time to explain every detail :)",Sophie  Jewell-Cole,GB,2025-05-10T13:58:51.000Z
5,"Gloucester store helped me transferring my data, was nervous going in as nt great with tech but Tom made it seemless",Robert,GB,2025-05-10T13:58:51.000Z
5,Great service by Yaz thank you for helping me out with my contract,Andy Elleray,GB,2025-05-10T13:52:18.000Z
5,Kathy was very helpful and very kind. She got me a great deal with both my phone and home broadband. I would recommend her to other people I would definitely come back to see her. She also explained things to me which I didn't understand.,Amy,GB,2025-05-10T13:47:38.000Z
5,Wesley was very helpful and informative. We were given all the information we needed and no over zealous selling of unnecessary products,Diane Weston,GB,2025-05-10T13:47:18.000Z
5,"Excellent service, very easy to deal with. Very happy",Consumer,GB,2025-05-10T13:46:51.000Z
1,I brought a Samsung zfold 6 from Vodafone 7 months ago. The middle screen has failed at the seam with absolutely no damage to the phone. I spoke to the customer service team and they told me to go in store to get it looked at and fixed. So I drove the 30 minutes to my nearest Vodafone store in scunthorpe who told me they don't deal with it in store and to call Vodafone directly!! I'm now left without a working phone and no bloody idea what to do! Last time I sent my phone away I was told the warranty was voided because of a chip on my screen which I had to prove there wasn't and so this time I'm terrified they will do the same thing. Terrible service.,Courtney,GB,2025-05-10T13:46:38.000Z
5,"Jack made the process very simple and gave me a great price. Very friendly guy, a credit to the company so if I need anything in the future I will definitely come back to see him",Chlo,GB,2025-05-10T13:42:43.000Z
5,,Stuart wilkinson,GB,2025-05-10T13:37:51.000Z
5,Lovely team! Fin was super helpful. Thank you very much :))),Louise Edes,GB,2025-05-10T13:35:39.000Z
5,"Neil, store manager at vodaphone folkestone. Customer service excellent. Greek sim issues, let us use his phone to connect to Greece customer services, well done",perrie keam,GB,2025-05-10T13:35:23.000Z
5,really helpful on deciding what new device to get. loads of information was given and i’m very happy with my new phone 🙂,Teigan Edwards,GB,2025-05-10T13:32:53.000Z
5,Very professional & accommodating. Helpful & we are more than pleased with the service we received.,Karen Moore,GB,2025-05-10T13:26:25.000Z
