Rating,Review,Name,Location,Date
5,"Jamal was so helpful in going above and beyond to help me resolve the challenges I had when I lost my own phone and also wanted to replace my daughter’s. He was solutions oriented, knowledgeable and completely customer-focussed in ensuring we left the store with the best possible outcome for our mobile phone needs.",Katie Frame,GB,2025-05-28T21:33:55.000Z
5,"I needed to upgrade my very old phone.  Natalie was so helpful.  All my photos etc needed to be transferred over, which took a very long time, but she was so friendly.  She found me a great deal on the latest iPhone.  A great experience!",Christina Drew,GB,2025-05-28T21:21:29.000Z
5,"Our experience was made so lovely today thanks to Rushabh, Andreea and Beauty. Amazing help and teamwork, they made everything so easy to understand and powered through all the technical difficulties with a smile. Thank you so much!!",Delia Groza,GB,2025-05-28T21:15:03.000Z
5,"I came in for an upgrade and was served by a gentleman called Chan. He was extremely helpful and very easy to talk to, my upgrade was sorted in no time and I’m very happy with my new phone.",Tom,GB,2025-05-28T20:46:01.000Z
5,"Went above and beyond and even stayed past closing time to get me sorted. Her name is Ms, Gurdeep I believe. Forgive me if I've butchered the name .",Samuel Mensah,GB,2025-05-28T20:19:15.000Z
5,"Great customer service from Azi today, thankyou!",Venus Costa,GB,2025-05-28T18:45:03.000Z
5,Jay was brilliant. He sorted out multiple issues with my account. I have 3 people on my account and Jay helped sort a more suitable plan for me and my daughters. My daughter’s phone had died and as a student finishing her degree in 2 weeks we needed a quick resolution. Jay provided that and all with patience and a smile.,Julie Barrett,GB,2025-05-28T18:33:04.000Z
5,"Fantastic experience with Haider, he helped my mom get a new phone!",Carol,GB,2025-05-28T18:25:54.000Z
5,Thanks Chan for sorting my new contract out. Was very helpful and polite and went above and beyond. Not many people want to help these days so you have given me some sort of faith! Thanks again for all your help. See you again soon xx,Raj Railan,GB,2025-05-28T18:22:12.000Z
5,"Daniel was really knowledgeable and a great help, great service and highly recommended!",Jill Morley,GB,2025-05-28T18:02:11.000Z
5,Ryan what an amazing man helped my mam when she was in tears over a phone that had not been received and he helped and sorted a new phone that day.,Lisa-Marie SMYTH,GB,2025-05-28T18:01:46.000Z
5,Lovely staff and great service,Maisie Morley,GB,2025-05-28T18:00:06.000Z
5,"My husband and I visited the shop and were served by Zeyneb and Awaaz. Excellent customer service, nothing was too much trouble. Please thank them personally from ourselves.",Sue,GB,2025-05-28T17:45:36.000Z
5,"Thomas ChippenhamGreat service, great attitude & very professional",Helen Henderson,GB,2025-05-28T17:45:08.000Z
5,Uzzy was really helpful in discussing the best options and selecting the plans,Sabrina Dasilva,GB,2025-05-28T17:38:17.000Z
5,"Namas,help very helpful, thank you",Aurelija,GB,2025-05-28T17:26:15.000Z
5,Abijith at the Harrow store was really helpful,Chamith Liyanage,GB,2025-05-28T17:20:08.000Z
5,Hakeem is a star.,Nash Chachona,ZW,2025-05-28T17:15:44.000Z
5,Hakeem was great - managed ro sort out an ongoing issue with 10mins. Great customer service!,Sony,GB,2025-05-28T17:12:56.000Z
5,"I spent days trying to collect a Gigacube router ordered via chat, however due to a typo added by the operator, IDV check failed at the store and I could not collect it. Surprisingly, no one at Vodafone could fix my name in my account. The only option was for me to submit a name change request which required the account number which I still didn't have since it was not activated yet. So basically I got locked out and no one could sort it out at Vodafone and the only option (less stressful) was to let the order expire and be canceled.Hopefully, I went to Vodafone Covent Garden to re-order it where I was assisted by Huseyin and Qasim who went above and beyond to ensure I had my plan placed and internet activated. I highly recomment reaching out to them, especially Qasim who overcame system's limitations to ensure my problem was resolved. Kudos to them for their customer obsession.",Fabrício Pinto,GB,2025-05-28T17:10:52.000Z
5,"Rayhan assisted me today and he has gone above and beyond helping me change contract, broadband and changing my number. He has been a pleasure to talk to,very informative and helpful. I'll certainly be asking for him if I need any further support in the future. Thank you.",M Summers,GB,2025-05-28T17:08:02.000Z
5,Friendly staff Nurul and Gary who are very knowledgeable.  Great advice on what I needed from a phone and didn't push the big sell.  Manager very professional and approachable.,Simon Robert James,GB,2025-05-28T17:01:50.000Z
5,Excellent service from kaylee couldn’t be more helpful,Lynne Sinnamon,GB,2025-05-28T16:58:40.000Z
5,"Edison at Marlborough High Street, Wiltshire Vodafone gave exceptional service today to a 90 year old with her daughter in the shop to acquire a phone update.  He took great trouble to make sure that the new IPhone 16 was user ready and more importantly new user understood and was both charming and extremely patient with 2 elderly women.  We could not praise him more highly for understanding the situation perfectly and managing the whole process beautifully. As said a quite exceptional level of customer care and service.",Morrison,GB,2025-05-28T16:57:13.000Z
5,"Great service as always from Gary today. Would recommend the Kirkcaldy Store, always very helpful when I visit.",Ronald,GB,2025-05-28T16:56:46.000Z
5,"Cristina was nice and helpful, and better internet connection would come in handy too)",Zhanna Dzhykhvashvili,GB,2025-05-28T16:42:15.000Z
5,Excellent advice and help from Jake highly recommend,Jeremy Hunt,GB,2025-05-28T16:41:39.000Z
5,Great help with staff in store,Fanet Mina,GB,2025-05-28T16:41:15.000Z
5,Plamen was amazing at fixing it phone. It had more viruses than I thought it had.,Rosemary Rains,GB,2025-05-28T16:35:19.000Z
5,Namira served us today. She was very knowledgeable and helpful. Thank you,Carol Crosby,GB,2025-05-28T16:31:20.000Z
5,"Saniya,very good worker, helped me quickly and explained",Cornel H,GB,2025-05-28T16:30:39.000Z
5,"Angela was so kind and helpful - she fixed a problem I had with my phone in a couple of minutes! I am now thinking of moving from EE to Vodafone! She achieved in two mins what EE couldn't in a TWO-HOUR online chat yesterday. She has made me so happy - I am now able to make a call from my phone to my husband in hospital. Thank u so much, Angela! U r the best! From Kate",Kate Chapple,GB,2025-05-28T16:25:05.000Z
5,Shamima was very helpful and patient whilst listening to my requirements for renewing my plan. She gave options and found me the best deal.,Lucy R,GB,2025-05-28T16:23:09.000Z
5,Nikki from the Nottingham branch helped my Mum to renew her SIM only contract and brought the price down with an increase in data. Everything went smoothly and I would recommend Vodafone.,Duke de Pommefrite,GB,2025-05-28T16:18:23.000Z
5,Faheem and the team at Redditch were brilliant helped me solve many problems and sorted out a amazing deal,Ryan Emms,GB,2025-05-28T16:12:15.000Z
5,Excellent service from Adam,Rod Summers,GB,2025-05-28T16:08:06.000Z
5,I’m a tech dinosaur and Glenn explained everything so well that I could understand it.,Niki Redfern,GB,2025-05-28T16:05:37.000Z
5,Great service at Harrow branch Vodafone by Abijith and his colleague.  Thank you so much.,khato Gegidze,GB,2025-05-28T16:05:14.000Z
5,Jonny was extremely helpful and informative am very impressed with the service,Allison,GB,2025-05-28T16:01:35.000Z
5,Brilliant service daniel,Mary Mcsorley,GB,2025-05-28T15:59:39.000Z
5,"Really great service by Ryan, very polite and very knowledgeable, and told us all we needed to know.",Kieran Isa Mayhew,GB,2025-05-28T15:49:36.000Z
5,"Ryan was very helpful and informative, answered all questions clearly and concise",Shahla Ali-Khan,GB,2025-05-28T15:49:17.000Z
1,Ordered a Vodafone 150 broadband package. On the day of connection I plugged in the power and ethernet cable as directed. It wouldn't connect. Couldn't speak to anyone directly so spent the next 6 hours on web chats. First 3 agents disappeared and the last one didn't inspire confidence. I had to cancel and go to new supplier. Vodafone back up was pathetic and they need to allow agents to converse in order to resolve. Never again!!,Joe Kelly,GB,2025-05-28T15:36:41.000Z
5,I visited the Alton branch today and got great custermer service. I up graded my phone and the guys were amazing very helpful thank you There was also a young man training he Luke.  He was also very helpful,Consumer,GB,2025-05-28T15:31:40.000Z
5,The teller was patient and he paid attention to every little details of my concerns.,Justice Adjei Manu,GB,2025-05-28T15:25:31.000Z
5,Haider at kings heath Vodafone was really helpful in terms of explaining prices and new offers and deals available. Will be back thanks to him.,John Houldey,GB,2025-05-28T15:13:26.000Z
5,Very helpful and polite,John Winter,GB,2025-05-28T15:04:24.000Z
5,Kasim amazing customer service,Maria Mitchell,GB,2025-05-28T14:58:18.000Z
5,Very quick friendly service. Oliver was very knowledgeable and helpful and found the right package for us .,Debbie hill,GB,2025-05-28T14:52:33.000Z
1,Garbage service lie to you about your bill and when contract runs out they don’t even let ya know charging loads of extra told em I wanted to cancel and they wouldn’t speak to me cause I had a bill to pay first bill people saying I had arrears from 2023 which is a complete lie cause everyone knows Vodafone would cancel calls if that was true wish to god I’d never let them talk me out of leaving worst network provider ever can’t wait to leave soon as contracts up,Consumer,GB,2025-05-28T14:45:20.000Z
1,"Ready to change my sim only plan as contract is ending, vodafone could not even come close to the contracts I have been offered elsewhere and after 22years of being with them they are happy for me to leave. When quoting o2 prices to them, they commented back that Vodafone's trust pilot reviews are better than o2, therefore I have decided to put my own review. Would give zero if there was an option.",Shane Loughran,GB,2025-05-28T14:42:30.000Z
5,"Great experience from Plamen today, high speed internet and new phone with good discount and so pleasantly presented",Emanuela Ahmedova,GB,2025-05-28T14:41:15.000Z
5,"Stephane is the best business advisor I’ve ever dealt with. He definitely needs a promotion. My best time I’ve ever had at Vodafone. I would definitely recommend a promotion for this young gentleman. Bless him, he made my experience one for the books",Thomas Jones-Nelson,GB,2025-05-28T14:33:14.000Z
5,Your assistant manager Rebecca was most helpful in opening a broadband account and merging my mobile with it. I hope her exceptional service will be recognized.,Consumer,GB,2025-05-28T14:28:28.000Z
5,Plamen got us a very good deal with the latest iPhone can not be happier,Velko Velkov,GB,2025-05-28T14:26:19.000Z
5,"Came in originally to check when my contract ended. Aaron was very helpful from the get go, especially since I had no clue what I was doing! He recommended multiple options for a cheaper price and answered all my questions. I ended up with a new phone there and then with a great plan. He even answered questions and gave my mum a quote for her phone and got her a cheaper deal. Overall a great service and super super helpful. Lastly I enquired about the broadband Vodafone offer, as I am moving house, him and his colleague answered all my questions on this which will help me make my choices. I’ve loved Vodafone for years, this experience added to that completely. :)",Elise French,GB,2025-05-28T14:24:58.000Z
5,becca has been a great help!!,meghan,GB,2025-05-28T14:17:13.000Z
5,Vinnie was excellent and very good . Very pleased,Kevin,GB,2025-05-28T14:05:13.000Z
5,Nat is fantastic could fault  her really useful and good her job,chris plant,GB,2025-05-28T13:57:10.000Z
5,Aaliah done an amazing job,N Martyn,GB,2025-05-28T13:42:53.000Z
5,"Faheem, a very nice and helpful gentleman. Excellent service",David Hasson,GB,2025-05-28T13:36:57.000Z
5,Daryoush listened so well to my requirements and helped me with saving money. It was great to meet him and he’s a credit to the company.,Christopher Webb,GB,2025-05-28T13:32:10.000Z
5,A smooth transaction and explained in detail..Andrew extremely helpful and proffesional..Happy with my changeover ..Barrie m,BARRIE MOYSEY,GB,2025-05-28T13:31:26.000Z
5,"Oliwia, the one who served us was so nice and patient with us. She explained well what my contract would entail and suggests other things that may interest me. The services offered we're also better and at cheaper price compared to my past network.",AAlejandro,GB,2025-05-28T13:24:46.000Z
5,"Hayden was extremely helpful, very polite and professional",Luke Martin,GB,2025-05-28T13:23:42.000Z
5,The staff here are always so friendly and very helpful.,Michelle Michelle,GB,2025-05-28T13:17:27.000Z
5,,Mr & Mrs Chowings,GB,2025-05-28T13:17:21.000Z
5,Richard was amazing at setting up my new phone and getting me set with all the right accessories,Marian Hewson,GB,2025-05-28T13:17:10.000Z
5,Came in store today to look to upgrade Manoj couldn’t of done more for me managed to get me the best price with even more features then I had before also managed to to get me a discount on my sons current plan!,N S,GB,2025-05-28T13:10:05.000Z
5,Billy was a great help and explained everything. Would definitely come back.,Robin Hulme,GB,2025-05-28T13:04:44.000Z
5,"Emma was helpful and knowledgeable, she made the experience of replacing a lost phone easy and straightforward. She is a pleasure!",Kathleen,GB,2025-05-28T12:40:05.000Z
5,"Yaseen was brilliant. He has excellent product knowledge and was personable and really sold me a phone that was going to suit my needs. He obviously enjoys his job and speaking and helping customers. I was very impressed as he remembered me from the last time I came in store when I was unsure on which phone to get. A very good member of staff and he interacted with his team members effectively too.I purchased a Samsung S25 Ultra, an upgrade from my old A22 5G.",R Dawson,GB,2025-05-28T12:35:19.000Z
5,Adam was very helpful and saved me money,Mark Beaumont,GB,2025-05-28T12:28:46.000Z
5,"Amazing, great advice and financialy better off thank u coree and billy",Marc Jones,GB,2025-05-28T12:18:47.000Z
5,"Fantastic, the guy who helped me was on his first shift on his own. He was super helpful!",Gemma Blay,GB,2025-05-28T12:16:27.000Z
5,Viking was absolutely lovely. Patient and very helpful. Explaining everything clearly,Margaret Bickerdyke,GB,2025-05-28T12:15:33.000Z
5,Saw a very nice helpful young chap to upgrade my phone. He didn't try to sell me things I don't need! He listened intently to what I wanted and met all of my needs. He even saved me money. Definitely recommend Vodafone.,Michelle Spiking,GB,2025-05-28T11:54:53.000Z
5,James was very patient and very very helpful,Lesley Huggins,GB,2025-05-28T11:54:01.000Z
1,Chatting to agents on Vodafone. Would help if they could understand English. I cant my bill on time as my bank card was cloned and agent kept asking how much can I pay today. I HAVE NO BANK CARD FOR 5-7 DAYS  until new card arrives in post,Andrew Jacobs,GB,2025-05-28T11:52:12.000Z
5,Ali was absolutely amazing 👏 amazing service,Mandy james,GB,2025-05-28T11:39:50.000Z
5,Great experience. Great customer service. Sawiera thank you,Ivy Kerr,GB,2025-05-28T11:39:04.000Z
1,"i would put zero stars if i could. Dreadful service, and so many faults on the line. Managers telling you there has never been any faults despite their staff sending several engineers all finding faults. Endless calls taking so long, each staff telling you the issues are originating from different sources from their colleagues and promising they will solve it. Endless disruption to my work. At the end they just try to sell you upgrades, which is what one their staff had the honesty to tell me ""they wont be interested in solving the issue because you are just on the standard (£38/month) package..",Agnes Munday,GB,2025-05-28T11:38:24.000Z
5,"Mo was lovely, helped us sort all of our queries out, I was very stressed & he relieved all my stresses",Consumer,GB,2025-05-28T11:27:59.000Z
5,Very friendly staff. Andy is very good and helpful.,Lynn Coles,GB,2025-05-28T11:26:08.000Z
5,Karl was amazing today and Enya!! Customer service was amazing! We got new phones and saved money !!! Amazing !,Sally Oldfield,GB,2025-05-28T11:25:19.000Z
5,"absolutely fantastic customer service, served by chrissy. outstandingly helpful and patient x",alfie bell,GB,2025-05-28T11:20:43.000Z
5,Amna was very helpful with my upgrade thank you so much,Stephen George,GB,2025-05-28T11:08:29.000Z
5,"Very good experience with Nahla in Vodafone Chiswick Store, many thanks Nahla you’re so friendly and helpful",Nigar Duman,GB,2025-05-28T10:59:59.000Z
5,Ionut was very kind. Very polite person and helpful.,Fabiano Ricardo Campos Alves,GB,2025-05-28T10:56:06.000Z
5,When I visited the store the staff were very friendly and helpful,Nicola,GB,2025-05-28T12:50:04.000Z
5,I was served by a lovely gentleman named keifer . He was the manager of the store. What a great guy. Offered us the best deal and we came away happy,Michelle Ansell,GB,2025-05-28T08:01:54.000Z
5,Keifer served me in the shop. He was very polite and efficient. Thank you,Clare Just,GB,2025-05-28T07:59:42.000Z
5,"Sam was brilliant, offered us a drink and talked through the plans and models. Left very happy, top lad.",Liam Parker,GB,2025-05-27T23:54:11.000Z
1,"I've been with Vodafone for some time now and I really can't wait to get out of my contract so I can find another provider. This has got to be the worst broadband I've had and I thought virgin media was bad! My broadband keeps dropping out, I've lost service for multiple weeks throughout the year which means I've had loss of income due to losing our on work (which Vodafone have NOT reimbursed me for). I can't stream without there being some kind of connection issues.nive spoken to multiple agents at the company all of which have no idea what they're doing! The last agent I spoke to transferred me to about 3 or 4 different people and I ended up with someone trying to sign me up as a new customer!!! Absolute shambles! Any review telling you Vodafone is the best overall provider must be lying. If I was you, I'd avoid at all costs. For a company that is legally contracted to provide a paid service, they do the complete opposite. I'm going to call Vodafone and demand they cancel the contract on their behalf due to their failure of providing the service I'm paying for!",MR,GB,2025-05-27T22:51:16.000Z
5,"Good evening !I would like to leave my sincere and honest review about my  amazing experience with Vodaphone shop in Manchester .(Market street ).Concern: I had my phone stolen and I’ve asked the Vodaphone  Team to swap a sim card  and get a new device in very short term ,20 minutes before  shop closing ,due to unforeseen circumstances.I have been assisted by Karan and Isac, what  were an amazing  Team with a best customer journey ,attention to the details have provided an absolute support .The customer service was 15 out of 10 ,they have done their best to provide a solution and  have done more than “above and beyond .”I would highly recommend this Team and you will always get an absolute support !Thank you ,Alina .",Alina Gorokhova,GB,2025-05-27T22:33:18.000Z
2,"I upgraded to their fibre package as I was struggling to get coverage to the far side of the house (approx 6-7 metres)! I was assured by the engineer and the staff selling me that the fibre installation would solve this problem!! However as soon as I was signed up they started to bombard me with emails about upgrading! My son continues to have coverage issues in his room, but all the support do is continue to offer costly upgrades!! Why would I pay more to a company who have already proved all they are interested in is making money???",BM,GB,2025-05-27T22:32:11.000Z
5,"Thomas provided excellent service, upgraded my sim today and talked me through the process. Credit to the store as he really went above and beyond.",James Longstaffe-Keith,GB,2025-05-27T21:59:48.000Z
1,Vodafone is one of the worst broadbands you could possibly choose. If you want to be able to play an online game or watch a tv show without interruptions get anything but Vodafone.,Ethan Wilson,GB,2025-05-27T21:11:27.000Z
5,Went in to the Bognor branch and Molly was wonderful! So helpful patient and understanding.Such a lovely girl very smiley happy and knowledgeable.,Heather Alderton,GB,2025-05-27T19:41:41.000Z
2,"Tried to cancel a data only SIM contract, could not do it before cutoff date because of I wasn't able to locate a 4 digit code I was supposed to get when I setup the contract in the shop. Managed to cancel on the first day of the reset and I still get charged an entire month of contract which I cannot use because I am on a different continent, meant to use for 30 days only. Other providers would be more clear with the cancellation policy. Internet wasn't the best, would not recommend.",bySillroe,ID,2025-05-27T19:21:10.000Z
5,"Haider was an incredible help sorting out a phone upgrade and SIM replacement. Great customer service, polite, informative and knowledgeable. Definitely recommend to friends and family.",Marie Winters,GB,2025-05-27T19:03:06.000Z
5,Beauty from Vodafone Oxford street resolved my network issue.  I had no network for 3 days.  She did some troubleshooting from the settings and my account.  It was very frustrating. All resolved now. My signal is working. Thanks to the beautiful lady.,Marius Vonta,GB,2025-05-27T19:02:59.000Z
1,Purchased vodafone broadband with the promise of an £85 gift voucher however after waiting the 120 days still no voucher. Vodafone say its a giftcloud issue and they should issue it but so far no voucher! All they do is make me wait longer and longer hoping I will go away!Really not the way to conduct a professional business by breaking promises to new customers!,Steve Green,GB,2025-05-27T18:21:45.000Z
5,"Dinath was very professional, kind, helpful with setting up my new Broadband in my home. Also offered some great Sim Only Deals. Which I will come back to him for. Very fast service and good understanding overall. Happy Customer. Will recommend all my friends and family.",customer shahpour zare moyadey,GB,2025-05-27T18:21:02.000Z
5,"Rhianna  us very welcoming cool , caring and very helpful. She is an asset to your company and please don’t lose her . We need such good workers in your vodaphone store . I wish her success and all best in coming future  . Keep it up .  Kind regardsRahul Sharma",Rahul Sharma,GB,2025-05-27T18:13:31.000Z
5,Came in to buyba SIM card for my son. Jay was very quick and efficient with the service,Beks Lita,GB,2025-05-27T17:56:27.000Z
1,"Avoid using Vodafone at all costs I’ve been using Vodafone for very long time recently they’ve joined with third party scammers to extort customers. Received a call from ‘Vodafone’ (who knew my Vodafone account number!!), they then signed me up for a contract without my permission and when I’ve contacted Vodafone to see why the bills are so high they said I signed up with a third party. If it was a third party and not Vodafone how on earth did they know my Vodafone account number? Vodafone now refusing to cancel the contract unless I pay an early termination of £56. Clearly Vodafone are partnering or paying scam companies to get in touch purporting to be Vodafone and tie customers into extortionate contracts!! Shameful behaviour!!",Aay Bee,GB,2025-05-27T17:53:12.000Z
5,Had a great experience with Asif today. Really great service and got the phone I wanted for a great price,Ingrida Culakova,GB,2025-05-27T17:50:07.000Z
5,"Tay was extremely helpful, friendly and professional",Steve G,GB,2025-05-27T17:47:29.000Z
5,Jeffrey was amazing,Esra,GB,2025-05-27T17:43:30.000Z
4,Nice and warm employee's Good service 👍,Ruhi Husseini,GB,2025-05-27T17:26:56.000Z
5,I want to thank the great advisor Katie for her help.she was been very helpful and patient she really done the job perfectly.Great thanks,Omar Musaad,GB,2025-05-27T17:26:46.000Z
5,"No pressure, informative and polite from sam",Gail Harper,GB,2025-05-27T17:26:02.000Z
5,Alex provided excellent assistance by thoroughly filling out the claim forms and demonstrating a great attitude while helping with my new Samsung phone. His support made the process much smoother.,Yordi Hiwety,GB,2025-05-27T17:25:24.000Z
1,"Tried to take out a broadband and VoIP home phone package over the phone. After 40 mins of discussion they told me it is against their policy to provide a digital phone unless one has a mobile phone. I told them this was nannying and contrary to Ofcom guidance and in any case it is my choice. Transferred me to a manager, but into a silent abyss instead. I should have lied, except I prefer to be honest - unlike Vodafone and the rubbish on their website about how easy it is to switch.",Rob,GB,2025-05-27T17:21:05.000Z
5,Debbie was a great help and made the process very easy,Jamie,GB,2025-05-27T17:18:48.000Z
