Rating,Review,Name,Location,Date
1,"Trying to buy broadband through Uswitch, then having multiple errors on checkout, only for customer services to say that they ‘can’t match third parties’There’s no matching needed, it’s a deal that’s come through from Uswitch! Don’t commit to offers your can’t deliver on - what a waste of time",Alfie Calas,GB,2025-06-05T22:03:24.000Z
5,Sona did a great job either my trade in and contract. Amazing service,Julliette,GB,2025-06-05T21:51:17.000Z
1,"One of the worst , if not the worst when it comes to signal , i get ""n"" messages to upgrade to the next best 5G phone but i get areas with (E)dge signal , total joke",Vlad Ureche,GB,2025-06-05T21:28:36.000Z
1,How those people get 4.6 rate that’s a joke my full fibre 900 has at the moment 267 shame that I cannot put my screenshots here never pick that company cannot wait when my contract will finished then I’m gonna find a real broadband provider Adam Farbotko,Adam Farbotko,GB,2025-06-05T21:14:08.000Z
1,"Held to ransom by a ‘reputable’ company. Purchased a sim only plan March 2023 for my mobile dongle. Service was fine for a while then poor so stopped using the sim in early 2024 but continued to pay as I had been told in a Vodafone shop that I would have to pay the full remainder of the sim plan up front to cancel early. At the end of the contract in March 2025 my 24 months was up so stopped paying. At this point I had paid over £350 for a service I had not used, which as I said above, upon the advice of the person at Vodafone, I accepted. Today, (5/6/25) I received a letter from Vodafone for the first time (that was not them trying to get me to purchase their home broadband) dated 30/5/25 saying I had an outstanding bill of £67.18, which had been sent to a debt collector and would be reported to the CRA on 4/6/25 which had already passed when I got the letter. I called Vodafone immediately, explained the situation and they demanded a payment of £98.32 for 3 months of service that they continued to provide me as they said there was no record of my attempt to end the contract in 2024 or my issues with the poor service. I said to them that I had paid til the end of my contract and then cancelled but they said there was no record and that in order to cancel and avoid further charges I had to pay the almost £100 which I certainly cannot afford. I an raising a formal complaint as I am disgusted by this greed and poor service. I want others to avoid the same experience that I have had. They’ll happily take your money for a service they’re not providing. Recon they will still report to the CRA despite holding me to ransom and forcing me to pay something I can’t afford. Appalled. Avoid at all costs.",Chloe,GB,2025-06-05T20:24:59.000Z
5,Excellent customer service. Vinnie was very helpful and patient.,Farida Ariori,GB,2025-06-05T20:05:30.000Z
5,"Excellent service from Rushabh! He explained everything clearly and in detail. It was the fastest SIM card process I've ever experienced. He also offered support in case I wanted to upgrade in the future. Overall, a smooth and pleasant experience. Thank you!",kawater alismaeel,GB,2025-06-05T19:52:59.000Z
5,"Steven listened then provided a number of options for me to consider, offering appropriate guidance throughout. He was very polite and at no point did I feel obliged to purchase.",Dylan Owen,GB,2025-06-05T19:43:30.000Z
5,Great experience at Vodafone today sorting my sim for VOXI. Leo was so helpful and very lovely. Highly recommend this store and Leo!,Maia,GB,2025-06-05T19:10:06.000Z
5,Shaun explained everything and was very helpful. Made the whole thing very easy and uncomplicated for non technical people like us. Thanks,James Hogan,GB,2025-06-05T18:56:03.000Z
5,Great help from Chelsea on upgrading my phone doing the trade in at the Northwich store. Extremely helpful and patient with me. I hope her dad had great birthday over the weekend just gone,Toby Lee,GB,2025-06-05T18:55:33.000Z
5,"I have a good customer service with Sully, Cristina Gracia and the other staff, they were helpful towards my Apple Watch Order, Thanks Again",i am Laure,GB,2025-06-05T18:47:29.000Z
5,"Mohamed was brillant and fixed my phone within 10 mins after 4 hours on the phone to support, thank you!",Romy Aitken,GB,2025-06-05T18:46:06.000Z
1,"This is the complaint I submitted to Vodafone: I was about to move flat and so I have ordered a home broadband for 19A M** Street . 2 days later I realised it was actually 19B M** Street and so I called your number, one of your agent told me ""NO WORRIES! YOU CAN CHANGE THE ADDRESS EVEN AFTER YOU RECEIVE THE ROUTER, THAT'S OK"" and so I waited. The day came and waited for the activation which never happened, the same day my neighbour at 19A got his broadband deactivated because of YOUR mistake. So now I have to wait 2 more weeks for a new broadband to be activated in my address (AND I WORK FROM HOME) since you can't provide that to me and my neighbour will have to wait 10 days to have everything sorted out, BECAUSE OF YOUR INCOMPETENCE. While I am on the phone with this agent to sort everything out she told me that she submitted the complaint to her manager which would have called me.. eventually. That's funny because that OBVIOUSLY never happened. But what disgust me the most is that when I call the first time to change my address YOUR AGENT CHECKED IF 19B WAS FINE AND THEY HAD THE AUDACITY TO SAY ""YES IT IS"" EVEN THOUGH IN THEIR SCREENS IT WASN'T. I worked for Vodafone and I know how it works, I will make sure to spend 5 minutes everyday to write on every social and every reviews website how CRAP you actually are. Don't try to call me because I won't answer, emails only. You wasted 1 MONTH of my precious time, the minimum would be to receive a refund for the fuel I had to spend to go to the office everyday because of your incompetence. Farewell",Adriana Castorina,GB,2025-06-05T18:44:57.000Z
5,As a customer for 45 years I have been much with such a very good service and kidneys which was exceptional,Henry,GB,2025-06-05T18:43:09.000Z
5,Tom was extremely helpful and kind to my very elderly mother. He really went the extra mile!,Samantha,GB,2025-06-05T18:37:58.000Z
5,Mandy helped fix an issue from another branch. Upgraded me to a phone,Margaret Robson,GB,2025-06-05T18:36:29.000Z
5,"She is very honest, helpful and very kind.",Saidha Shaik,GB,2025-06-05T18:36:11.000Z
5,She is very good can't even imagine how good she is.,Achsah,GB,2025-06-05T18:35:43.000Z
5,Mark in store was absolutely fantastic,Bill jefferson,GB,2025-06-05T18:23:18.000Z
5,Eric and Junior are wonderful people help me set up new phone and tell me how to use it.,John Church,GB,2025-06-05T18:14:23.000Z
5,Billy was fantastic; thank you so much for helping me out mate! I really appreciate it 👍🏼,Tahmid,GB,2025-06-05T18:09:36.000Z
5,"Amazing customer service from Lewis, came in for 1 phone and sold us 2.",Cameron Grace,GB,2025-06-05T18:05:12.000Z
5,"Michal was amazing, helped us got us sorted out, really recommend using vodafone",Lilly,GB,2025-06-05T18:04:37.000Z
5,,Ruby Waters,GB,2025-06-05T18:04:15.000Z
5,"Amazing service, went in with an issue with a disabled SIM. Sorted it out efficiently and walked out good as new.",Achu Ajith,GB,2025-06-05T17:59:54.000Z
5,Uzzy was helpful  got me a new contract and upgrade my home broadband. Thanks guys,Ahmadzia haqmal,GB,2025-06-05T17:59:23.000Z
5,Harika was really helpful and whole staff is really amazing.,Manu Moradia,GB,2025-06-05T17:58:55.000Z
5,Ethan was vert helpful and helped us save lots of money on our monthly bill,Tony Leach,GB,2025-06-05T17:51:27.000Z
5,"Wonderful service from the shop staff, nice to know I can ask for help when I need itThank you",Margaret Shields,GB,2025-06-05T17:35:45.000Z
5,Hayley was great !! The whole process was easy and straightforward. would recommend to friends and family,Jamrock Joe,GB,2025-06-05T17:34:54.000Z
5,Me and wife upgraded and Sanzcia was so helpful and friendly,Rich,GB,2025-06-05T17:29:35.000Z
5,Rushabh was very good and gave me a GREAT treatment when ordering my new phoneHe is a very smart and helpful person,jaime gilinski,US,2025-06-05T17:28:03.000Z
5,Sanzcia was amazing really helped us out with transferring our new phones would have never done it without her! Thank you so much,Julie,GB,2025-06-05T17:14:58.000Z
4,Helped me find a cheaper deal on contract,Alistair,GB,2025-06-05T17:13:10.000Z
5,"Shamina was very thorough, patient and easy to talk with. All the details of my purchase and new contract were explained clearly. A pleasure to be served by her",Mr Brading,GB,2025-06-05T17:12:11.000Z
5,"Great support with finding contracts and helping decide best way to deal with a broken screen. Help with understanding PAC codes, taking phones back to original settings.Friendly service",Michelle Cheetham,GB,2025-06-05T17:04:11.000Z
5,We visited the store for an upgrade. Max looked after us and it was painless. Definitely recommend. 👍🏼,Consumer,GB,2025-06-05T16:58:09.000Z
5,Lauren Patient - bubbly- knowledgeable - helpful - friendly and an excellent employee for you guys! Thank you,lorraine lloydroberts,GB,2025-06-05T16:54:04.000Z
5,"I wish to express my gratitude for the exceptional service I received today from Edward Watts.I had been encountering issues with my phone and was unable to resolve personally.Edward was an absolute pleasure to deal with from the moment I entered the Orpington branch.He was highly professional, attentive and very friendly with a genuine desire to resolve my issue which he did with the minimum of fuss.He addressed matters in a very swift and courteous manner and whilst at the branch managed to source a fantastic new deal for me saving me over 50% in billing cost per month.I spent 20 years in sales and his product knowledge and customer care standards were first class.I have always subscribed to the view, ‘ people by people first ‘ from a customer perspective and this is what really impressed me about him within 30 seconds. It was a joy to deal with him and I left the branch exceptionally happy and more than satisfied by the service I received from this staff member. I am sure he fits the exact profile of your company and I feel sure he has the qualities to enjoy a very successful career with Vodafone.Kind regards Kevin Mills",Kevin Mills,GB,2025-06-05T16:52:09.000Z
5,"I have been comming to Loughborough store since it first opened. Every member of staff have been helpful above and beyond. Today I was served by Bhavin who was extremely helpful. Spending time with me, explaining the transactions from my old phone to this one.",Anita Jarvis,GB,2025-06-05T16:48:07.000Z
5,"I came to this brach after spending 2 hours on the online chat trying buy a service. This friendly bunch of people took care of it in 20 minutes. I was planning to leave Vodafone until I met these people. 5-star people, 5-star branch.",Atilla Orbay Tuğ,GB,2025-06-05T16:39:39.000Z
5,,Gülcan Şahin Woods,GB,2025-06-05T16:35:17.000Z
5,Saw Dan in  the kendal shop. He was amazing helpful and informative. I would definately recommend going to Dan for any of your questions he has ALL THE ANSWERS.  Thankyou Dan,Mrs Armer,GB,2025-06-05T16:34:32.000Z
5,Really helpful and patient staff members at Vodafone Ayr. Thanks Alex!,Marion Gilmour,GB,2025-06-05T16:22:23.000Z
5,Good job. Amazing experience by aadil,Ron,GB,2025-06-05T16:20:48.000Z
5,"Very helpful staff, nothing too much trouble",MrsGillianChapelhow,GB,2025-06-05T16:18:41.000Z
5,"I had a fantastic experience with Justyna at Vodafone when purchasing a new device plan and airtime. She was incredibly helpful, knowledgeable, and patient throughout the whole process. Justyna took the time to explain all the options clearly and made sure I got the best deal suited to my needs. Her friendly and professional attitude made the experience smooth and enjoyable. I left feeling confident and very satisfied with my purchase. Thank you, Justyna, for your excellent customer service – you’re a true asset to Vodafone!",zakitoo,GB,2025-06-05T16:18:23.000Z
5,Lukas was very helpful and we are more than happy to come back to store again!,Leila Pickard,GB,2025-06-05T16:16:40.000Z
5,I was served by Kayla who was able to help us find the best way to get additional data! She was excellent and friendly,Leigha,GB,2025-06-05T16:14:17.000Z
5,What made the experience great was the incredibly helpful and efficient resolution of my problem by store manager Moin.  He made everything easy when it could have been difficult.,nick spoliar,GB,2025-06-05T16:03:28.000Z
5,"Simon was superb!  Super patient, really helpful with looking for deals for my dad.  Explained a lot of the differences and found the best bundle.  Can’t thank Simon enough for his kindness and patience today! Thank you Simon. We’ll be back……hopefully for the iPad :)",Jodie Fuller,GB,2025-06-05T16:01:41.000Z
1,1 Star is 1 Star too many !! Time to Leave this shambolic company !! Shame 18 years loyal !!,Bradley Maybin,GB,2025-06-05T16:00:32.000Z
5,"Thanks Lee for helping sorting out our phone issue, you are great",Mr. Terrance Roffey,GB,2025-06-05T16:00:11.000Z
5,"Brilliant customer service, really helpful Apphia was so lovely. Best Vodafone experience I’ve had",Gina Mccleary,GB,2025-06-05T15:59:25.000Z
5,"Tayyab was very helpful, clear and efficient. Many thanks!",Michael,GB,2025-06-05T15:57:14.000Z
5,"Great service from Leon, sorted me out a good deal",Miss SS,GB,2025-06-05T15:53:18.000Z
5,Very helpful guy Noah in Crawley branch (thinks that’s his name) .shame Vodafone has to charge to get your new fone up & running now. Last time it was free.,sally barrett,GB,2025-06-05T15:53:13.000Z
5,Diego and karina did an amazing service and help me very well with what I was looking for,Matteo Perreau,FR,2025-06-05T15:52:23.000Z
5,Amazing service always been good ash is really helpfull,Ruby Lily,GB,2025-06-05T15:49:39.000Z
5,I am using Vodafone from last 5 years. This is the first time I got a supreme professional service from Vodafone sutton store. Zoe is a superstar and vodafone needs more staff like her.,Golam Bitu,GB,2025-06-05T15:40:07.000Z
1,Terrible!!!Been taking money out of my bank for 6 months for a package what’s not mine.Promised me a refund within 5 days.No refund yet more money taken.It’s easier trying to speak with someone who’s passed away than it is trying to get money back.If I owed it to you you would be ringing me quick enough,Caroline Sales,GB,2025-06-05T15:35:05.000Z
5,Great experience Chris at crystal peaks was very helpful,Sue cooper,GB,2025-06-05T15:29:22.000Z
5,My savouir has sorted everything out even though we did it in currys,Suelock,GB,2025-06-05T15:22:03.000Z
5,,Fiona Docherty,GB,2025-06-05T15:19:20.000Z
5,I was served by bil today who was great company an helped me secure a great deal,Cameron Walker,GB,2025-06-05T15:16:53.000Z
5,Very friendly service   staff was polite and went the extra mile to make the customer 😊 I would recommend Vodafone  😊,Erica Matthews,GB,2025-06-05T15:02:13.000Z
1,Sold a phone contract in my name to someone who isn't me and now I am dealing with debt agencies and my credit rating ruined. Absolute thieves. Get ready,Andy Folgate,GB,2025-06-05T15:00:42.000Z
5,Perfect helping man chatting and lovely person sean,Alison,GB,2025-06-05T14:54:59.000Z
5,Perfect customer service. I will definitely be returning to the Sunderland store in the future. Thank you Beth for helping.,Donna Callaghan,GB,2025-06-05T14:52:54.000Z
5,Good one from Tarang,Susan Chen,GB,2025-06-05T14:52:51.000Z
5,,MD. ABUL MONSUR,BD,2025-06-05T14:52:48.000Z
5,Jamie was brilliant at explaining all details of new sim card,Consumer,GB,2025-06-05T14:48:22.000Z
5,Hassan looked after my daughter and son. Gave me a good unlimited additional line and upgrades My son on unlimited at a bargain price,Nolasco Coroza,GB,2025-06-05T14:47:50.000Z
5,Hassan was very good and gave us the best possible way to pay for unlimited data,Diane Coroza,GB,2025-06-05T14:46:56.000Z
5,"Good knowledge, friendly",Brunnie Lyn,GB,2025-06-05T14:44:10.000Z
5,"Ali was very helpful today. Friendly, great service. Was able to get an additional sim for my daughter too, at a great price. Thanks for the assistance!",Holly Lianne,GB,2025-06-05T14:42:45.000Z
5,Cedric very good 👍 👌 👏,thevarasan veloo,GB,2025-06-05T14:39:49.000Z
4,"The staff were very helpful, service was quick and helpful, only slowed down by the technology which they couldn't help.",Xager,GB,2025-06-05T14:38:04.000Z
1,"Terrible experience.Had fttp arranged for install for the 19th May. 2 subcontractors later (mj Quinn) who were not interested in the scale of the job quickly attended and disappeared, not referring the correct data back to Vodafone and open reach.10 days later we get the installed.  In the meantime Vodafone were next to useless. I also used all of my data and had to top up costing me £36 in a week.They said I’d get a refund but then charged their minds.Still waiting for the £6 a day compensation too Avoid",Customer,GB,2025-06-05T14:36:21.000Z
5,"I was helped by Stephan today at the Westfield White City store, extremely great service, I couldn’t recommend him and the team more. So happy I switched to Vodafone!",Trifene Maba,GB,2025-06-05T14:28:18.000Z
5,"Fab service from Danny, explained things very well and saved me money. Excellent",Ian Ford,GB,2025-06-05T14:27:58.000Z
5,The change over to new phones was easy and zanas was veryhelpfuland polite.,les cooper,GB,2025-06-05T14:24:42.000Z
5,Excellent service from Liam regarding my phone contract upgrade. Provided me with a number of options and went through each in thorough detail. Great experience and will be returning in the future.,Zak,GB,2025-06-05T14:24:27.000Z
5,Zanas was Very courteous  and helpful. Answered our questions clearly .,Cooper Susan,GB,2025-06-05T14:23:16.000Z
5,Danny was very helpful. Brilliant,Jean Ford,GB,2025-06-05T14:22:04.000Z
5,"Excellent Service, really pleased with the help I received from Liam. Would recommend him to anyone who had any stresses when purchasing a new phone!! Thank you Liam :)",Dylan Williams,GB,2025-06-05T14:22:01.000Z
5,"Excellent service from Gary, helped me with all my needs, highly recommend.",Kyle Tait,GB,2025-06-05T14:15:31.000Z
5,"Was served by a lady named Kady. She was excellent helping me find the right phone for my upgrade. Also, assisted me in my data transfer. What a lovely contribution to the team. Need a lot more like her, lovely energy and great presence!",patience muchena,GB,2025-06-05T14:02:41.000Z
5,Mike was so helpful when I had a query with my bill and sat and explained everything for me … also told me about a great broadband deal … with definitely go back,MARY,GB,2025-06-05T13:58:04.000Z
5,Mark was so helpful and made the process of upgrading very easy.,Jack Wilson,GB,2025-06-05T13:57:32.000Z
5,Mark was a great help and so friendly.,Rebecca Wilson,GB,2025-06-05T13:56:01.000Z
5,Was recommended by my family who are all on Vodafone. Only because of the people in this store. Store manager has been here for years. Delivering the same great consistent service,Mary Herlihy,GB,2025-06-05T13:50:49.000Z
5,Great staff. Very helpful. Got everything I needed with no problems at all,Brooke,GB,2025-06-05T13:47:46.000Z
5,Love coming here always very helpful nothing ever to much. Questions and service always met by the staff with great attitude,Dianne Herlihy,GB,2025-06-05T13:46:19.000Z
5,Simeon the store manager was very welcoming and met my needs accordingly,Roni Maurice,GB,2025-06-05T13:45:58.000Z
5,Humzah has helped me out very well. Got me the best price and assisted in all my questions. I highly recommend him.,Nina,GB,2025-06-05T13:45:22.000Z
5,The retail adviser that served me (Liam) was really helpful and amazing. Gave me the best deals. Would recommend people coming here. Best customer service.,Eliese Chapman,GB,2025-06-05T13:44:19.000Z
5,"The best shop in the world, will not go anywhere else. Been served by Serj and Imran for many years always very helpful and sort all my family out",Joanne Whitmore,GB,2025-06-05T13:43:59.000Z
5,Dylan at burgess hill is always so helpful,Goldsmith,GB,2025-06-05T13:42:36.000Z
5,,Ray Gor,GB,2025-06-05T13:27:28.000Z
5,"I got a new Samsung from Vodafone in Omagh, the service was friendly and Bradley talked me through some of the new features on the phone, would highly recommend",Paul,GB,2025-06-05T13:21:02.000Z
5,Amazing service and amazing team The lad that was helping me was amazing at his job he should get a pay raise thank Faheem,Nathan Wiltshire,GB,2025-06-05T13:20:31.000Z
5,"Came in to upgrade my phone, Lani and the rest of the staff were very knowledgeable and friendly. Was very happy with the service and looking forward to my new phone.",Chloe Mansell,GB,2025-06-05T13:19:08.000Z
5,Very good service at the Vodafone shop in burton on trent.  Ryan and zanas helped.,Darren Blackwell,GB,2025-06-05T13:14:54.000Z
5,Dealt with quickly and expertly by Mark  who reduced my mobile tariff and talked me into switching from Sky Broadband to Vodafone  saving me more money. Winner!,Mac McFadden Comic Poet,GB,2025-06-05T13:13:54.000Z
5,,Popa Maria-Alexandra,GB,2025-06-05T13:12:45.000Z
5,"I went to Vodafone to resolve some issues with my contract for 2 phones and 3 SIM cards and I was impressed by the professionalism of the worker Avneesh who took care of my problem, solving everything. I want to mention that I don't speak 100% English, but he was patient enough to let me explain my problem and answer in a way that I could understand.",Mihaela Malancioiu,GB,2025-06-05T13:12:13.000Z
5,Went to Huddersfield Branch to get advice on new SIM and served by Kinza. She went through all the options available and decided on a 24 month contract with free European roaming. She also looked into upgrading our broadband and offered a faster speed. Great service with a smile. Thank you,Sheila  Firth,GB,2025-06-05T13:09:51.000Z
5,Wonderful service getting changed over from us to uk!,Alex,GB,2025-06-05T13:03:41.000Z
5,Alexandre was excellent . Thank you so much,Val Hall,GB,2025-06-05T13:02:20.000Z
5,Rob was extremely helpful in setting up my mobile broadband. I also renewed my sim plan to get a better deal,Matty Whittaker,GB,2025-06-05T13:02:07.000Z
5,"Excellent ,friendly ,informative ,problem solving experience with Harrison re upgrade .",Della Stevens,GB,2025-06-05T12:58:48.000Z
5,Dylan & staff today was very professional and helpfull for what I needed them to do for me and xplained all thoroughly.,Wayne,GB,2025-06-05T12:58:47.000Z
5,Very welcoming experience from Taj. He found the best deal for my upgrade,Consumer,GB,2025-06-05T12:57:50.000Z
5,"We were served by Taj today, amazing service, friendly face and professional service throughout! :)",Ellie,GB,2025-06-05T12:56:33.000Z
5,Great service from Gary today and saved me a huge amount on my sim and broadband. Thanks again for all your help.,H K,GB,2025-06-05T12:56:21.000Z
5,Had a great experience with Dom in the llanelli store. We had multiple questions and he managed to sort everything very efficiently. Upgrading myself and my husband. Thanks again.,Karen Jerwood,GB,2025-06-05T12:54:13.000Z
5,Lachlan from  Inverness store 100% experience 11 out of 10,Donna Grant,GB,2025-06-05T12:52:17.000Z
5,Amazing service with help setting up my new phone. Cheers Dan,Alison Brough,GB,2025-06-05T12:41:15.000Z
5,"The advisor got us a new phone, new home internet and transferred everything for us. Brilliant service from Vodafone.",Nicholas Fredrick Hackett,GB,2025-06-05T12:40:20.000Z
1,I have been experiencing very very poor signal/reception using for phone calls to both incoming and outgoing voice keeps breaking and the signals bars change to one point more frequently in my area Slough Berkshire When spoke to customer service they asked me to pay off my whole contract amount to exit from Vodafone very frustrating and called couple times standing outside of my house to the network team but the calls keeping disconnected after the wait of 35 minutes initially some lift the call take all details to verify me and when they transferred the call to technical team after wait of half an hour the calls get disconnected with no response very frustrating.Called customer care and been waiting for over an hour to connect. Still hopeless to get the support from Vodafone every attempt to call for disconnection needs waiting for over an hour but when we call for new connection the calls keeping disconnected gets connected in 5 minutes,Bharath Bashetty,GB,2025-06-05T12:51:28.000Z
5,Amazing as always been a long standing customer,Cairo,GB,2025-06-05T12:30:58.000Z
5,Very helpful. Good service and pleasant staff.,John Bosworth,GB,2025-06-05T12:28:48.000Z
5,"Kaz and Halimah at Walsall helped me set up my phone, and got the app working, he sorted my wife out too thank you guys",Barry Hughes,GB,2025-06-05T12:28:43.000Z
5,"Amazing customer service great support ,",Agata Brzozowska,GB,2025-06-05T12:25:06.000Z
5,The service was really good. Anthony was fantastic!,Fares Nsouli,ES,2025-06-05T12:19:58.000Z
5,Charlie transfered my data over quick and easy great services and help in this shop will come back again thanks again charlie,james evans,GB,2025-06-05T12:16:42.000Z
5,I came in as I was unable to transfer my data from my old phone to my new one. Jamie was extremely helpful and friendly and transferred all my data for me.,Mr Windsor,GB,2025-06-05T12:04:10.000Z
5,Sami was really helpful and has great knowledge on phones,John Williams,GB,2025-06-05T12:03:00.000Z
5,I went to Vodafone shop today met with asleep she did my upgrade and she solved my problem .I AM VERY HAPPY,Thakayil Ravi,GB,2025-06-05T12:02:29.000Z
5,Charlie was knowledgeable  patient no problems brilliant would recommend to everyone thanks Charlie,Gerry,GR,2025-06-05T11:59:12.000Z
